RAIVA vou ter que ir com meu nike dinovo pra escola ; minha mãe lavou meu all star;-1
Paulinhoo'Loopes o famoso Brankelo da Nike #TeAmo mto meo brankelo ;$ irmãozinho do conceito + gatoo &lt;3;1
A @user e @user vão sortear uma camisa Nike oficial da seleção brasileira pelo Twitter.Saiba como no link: ~http ;0
#Cristiano Ronaldo's NIKE Speed test: ~http ;0
AGORA EU ACHO QUE O RONALDINHO VAI JOGAR A BOLA É DA NIKE !!!;1
Eu queroooooooooooooo. *-* RT:. @user  O Boné Nike do Centenário ficou irado! ~http ;1
Tênis ou sandálias? — Nike Dunk ~http ;0
Jaqueta Nike Corinthians N98 Centenário Promoção de R$ 229;90por R$ 159;90Economia de R$ 70;00 (30;44%)  ~http  vía @user;0
Vou comprar um Nike colorido em maio o meu Freeday ta ficando zuado :S;-1
cada um que me aparece; o muleke colocou no FACEBOOK; NIKE SHOX PAH' (H).           --';-1
too mega feliz ganhei meu nike 6.0 hj :);1
sonhos se realizam: Será que a Nike finalmente vai lançar o tênis q se amarra sozinho; aquele do McFly?  ~http  via @user;1
Kit Relógio 3 Pulseiras Nike Cuff      de R$ 199;90 por: R$ 99;90 ~http  via @user;0
Xinga o Justin Barbie mas usa um nike igual ao dele #FAIL (@pecesiqueira live on ~http );-1
gostei do tenis azul la :D ; eu tenho a nike 6.0 preto :P;1
1 e 6 da manha e eu tuitando daqui do quarto do hotel!!!! mt bom hj!!! '------' comprei um nike shox e uma Gap hoodie;1
Comprei um short da Nike e o meião canguru da Penalti preto pra jogar no interclasses! :D;1
Tênis Nike encosto alto W Por apenas R $ 249;90 ~http ;0
KKKK ~http  Vc Nao entra na chácara Traira RT“@gabriel_oficial: @user to levando uma pro ce da nike porq adidas ta foda rs;0
BOM DIA!!! Hj é sexta! Amanhã chega visitas ilustres; prima Nike e amiga Cely. Bom d+!!!;1
Muito legal essa matéria no nike corre sobre a meia maratona de Halloween nos EUA ~http ;1
BOM DIA!!! Hj é sexta! Amanhã chega visitas ilustres; prima Nike e amiga Cely. Bom d+!!!;1
Eu achei um da Nike igual ao da Dems.... Tô em dúvida se levo ele ou um outro que eu gostei..;0
Esse nike sim é vida (k);1
Acabei de ganhar uma camisa. da nike ... muito show;1
Quero ganhar Camisa Nike Manchester Home ou Away Original - O Mundo do Esporte ~http  #Sorteio @user (via @user);0
SORTEIO: CAMISA NIKE OFICIAL 3. Dê RT desse tweet e siga @user até HOJE (15/12) as 12h ~http ;0
e o NIKE ROSA que minha mamis comprou pra ela; MORRI DURA ! Lindissímo; quero ele pra mim :(;1
VOLTEI \O/ comprei meu tenis da nike & minha blusa da marimonroe *-*;1
Até que enfim meu @user pegou o Nike dele de volta; depois de 6 meses guardado na casa de um amigo dele.;1
lool *-* eu vou ganhar um nike da @user  kkk s2;1
A NIKE convido eu e o meu primo o gui pra surfar no rio;1
meu sobrinho está tão lindo *-* fazendo caretinha e dando um role de Nike zo/;1
ganhei uma bolsa linda da nike do papiis (:;1
ontem foi muiiiiito bom; festa da nike no arpex depois festa novamente ! cheguei em casa de madrugada cansadao; hj é so relaxar;1
muito legal o treino hoje estreiei o meu novo tênis nike ctr360 muito tri;1
ae mlkada o @user vai me arranja uma regata da nike e uma da adidas *-* ; AHHAHAAH';1
alguém sabe ; algum site qe veenda o Nike Dunk High ?;0
Eu queroooooooooooooo. *-* RT:. @user  O Boné Nike do Centenário ficou irado! ~http ;1
gente esqueci de contar hoje ganhei um nike muito fofo *-*;1
Vou comprar meu nike *-*;1
oi; voltei; fui lah na BackWash e comprei um Nike 6.0 meio esquisito mais bunitinho *-*;1
Dia 07 no feriado vem curtir edição especial da LIIBRA com lançamento da NIKE !!!!!!!!!! ~http;1
comprei um nike 6.0 ontem mto GAY mas eh bunitinho ahsuahsuahsau;1
Compras de nike e reebok. axo xique! adoro;1
Caaara; esse nike que minha avó me deu é o melhor tenis que eu já calcei EVER!!;1
Só faltou o @user pra propaganda da Nike ficar perfeita.;1
Não sou tão fã do Ronaldo; mas esse comercial da Nike é realmente digno de uma lenda ~http ;1
o nike do chaz ortiz é muito lindoooo;1
#sorteio 2 tênis nike fem. cadastre-se no site ~http  participe aqui ~http  (@lojatenisonline) #TwitPromo;0
hoje eu vi uma menininha com um tennis da nike roxo tão lindu *-* rs;1
Simplesmente inadimissível !!!!! Enquano a Globo; CBF e Nike escalarem o time vai ser isso aí....e 2014 tá chegando....que vergonha!!!;-1
"Quero ganhar um Nike 6.0 que a @user está sorteando! (~http )""";1
